{
  "id": "TKT-BALANCE-MAP-ELITES-ENGINE",
  "title": "MAP-Elites Quality-Diversity engine",
  "pillar": "P6",
  "effort_hours": 14,
  "donor_game": {
    "name": "MAP-Elites QD",
    "tier": "E",
    "matrix_anchor": "docs/research/2026-04-26-tier-e-extraction-matrix.md#6-map-elites-quality-diversity"
  },
  "agent_owner": "balance-illuminator",
  "status": "proposed",
  "reuse_level": "full",
  "audit_source_doc": "docs/reports/2026-04-27-stato-arte-completo-vertical-slice.md",
  "created_at": "2026-04-27",
  "created_by_agent": "claude-code",
  "summary": "Archive multidimensionale di elite per ogni cella feature space. Spec doc live, runtime engine pending."
}