{
  "id": "TKT-UI-TACTICS-OGRE-HP-FLOATING",
  "title": "Tactics Ogre HP bar floating sopra sprite",
  "pillar": "P1",
  "effort_hours": 6,
  "donor_game": {
    "name": "Tactics Ogre Reborn",
    "tier": "S",
    "matrix_anchor": "docs/research/2026-04-26-tier-s-extraction-matrix.md#3-tactics-ogre-reborn-square-enix-2022--p1-ui--p3"
  },
  "agent_owner": "ui-design-illuminator",
  "status": "proposed",
  "reuse_level": "minimal",
  "audit_source_doc": "docs/reports/2026-04-27-stato-arte-completo-vertical-slice.md",
  "created_at": "2026-04-27",
  "created_by_agent": "claude-code",
  "summary": "Refactor render.js HUD da sidebar a overlay sprite (breaking change cosmetic). Doc 44-HUD ranking 5/5."
}