{
  "id": "TKT-UI-DEAD-SPACE-HOLOGRAPHIC-AOE-CONE",
  "title": "Dead Space holographic projection cone per AOE ability targeting (hybrid HUD layer)",
  "pillar": "P1",
  "effort_hours": 5,
  "donor_game": {
    "name": "Dead Space",
    "tier": "A",
    "matrix_anchor": "docs/research/2026-04-26-tier-a-extraction-matrix.md#11-dead-space-visceral--2008"
  },
  "agent_owner": "ui-design-illuminator",
  "status": "proposed",
  "reuse_level": "minimal",
  "audit_source_doc": "docs/reports/2026-04-27-stato-arte-completo-vertical-slice.md",
  "created_at": "2026-04-27",
  "created_by_agent": "claude-code",
  "summary": "Decision codified 2026-04-27 (HUD canonical = Tactics Ogre overlay-rich + cherry-pick Dead Space). Render proiezione cono diegetic da caster per AOE ability targeting (in-fiction tooltip pattern). Layer additivo a Tactics Ogre HUD canonical. Stretch goal P1 visualization.",
  "museum_card": "docs/museum/cards/combat-tactics-ogre-hp-floating-charm.md"
}
